extracted_text,uid,wiki_link,article_title,topic
הן מכונות תגובת שרשרת של פולימראז בזמן אמת אימונוקוונטיטטיביות (immunoquantitative PCR -iqPCR) הסמן,39fa6c73-0fb6-4704-b108-2aa396986704,https://he.wikipedia.org/wiki/אימונואסיי,אימונואסיי,Medicine
"כך, פצוע תאונת דרכים עשוי להיות מועבר מהמחלקה לרפואה דחופה לחדר הניתוח, ממנו ליחידה לטיפול נמרץ ומשם",11319934-944d-47f9-b8e5-3cda00fe3d6a,https://he.wikipedia.org/wiki/אשפוז,אשפוז,Medicine
"המחקר שלו הוביל לזיהוי ""העיקרים של קוך"" – ארבעה קריטריונים שנועדו לקבוע קשר סיבתי בין גורם מיקרוביאל",445aff7a-5b52-4d06-982c-db44fc7d21e4,https://he.wikipedia.org/wiki/רפואה,רפואה,Medicine
"את הבקשה להוספיס בית ניתן להעביר לרופא המשפחה או לצוות המחלקה בבית החולים.


== ראו גם ==
ביטוח בריא",e6f62968-2464-4ecd-9367-6674f1f19953,https://he.wikipedia.org/wiki/אשפוז_בית,אשפוז בית,Medicine
"גן זה, או לפחות גן הדומה לו מאוד בהרכבו, מצוי גם בבעלי חיים מפותחים יותר, לרבות ב-DNA האנושי. 
במהלך",bb85d0d8-f370-4a29-aeed-65e4b1610981,https://he.wikipedia.org/wiki/DAF-2,DAF-2,Medicine
תכונה זו מופעלת בסדרה של רמזורים (על פי רוב שלושה או יותר) הנמצאים על ציר נסיעה. תכונת הגל הירוק מיו,d9fe6675-dfbc-4f59-b844-ae93aac2fefb,https://he.wikipedia.org/wiki/גל_ירוק,גל ירוק,Transportation
"  
בישראל קיימים נכון לשנת 2009 רק ששה אזורי שירות, כולם לצד כביש 6 - שניים ליד נען, שניים ליד להבות",886ae274-8660-4cec-8734-385c34c40c81,https://he.wikipedia.org/wiki/אזור_שירות,אזור שירות,Transportation
תחבורה היא העברה של אנשים וסחורה ממקום אחד למקום אחר על ידי אמצעי תחבורה. ישנם אמצעי תחבורה אוויריים,7e121651-0207-4807-842a-2639fa452442,https://he.wikipedia.org/wiki/תחבורה,תחבורה,Transportation
חברות רבות משתמשות בשיטות אלו מכיוון שכך הן חוסכות בהוצאות תחזוקה ובעלות על מטוסים שאין לחברה צורך ב,7fed3621-ab3b-4108-95e9-2e414765fdf9,https://he.wikipedia.org/wiki/חברת_תעופה,חברת תעופה,Transportation
"בזמנים קדומים התחבורה באמצעות נהרות הייתה קלה לאין שיעור לעומת התנועה בדרכים[דרוש מקור], בהתחשב בעלו",48360aa4-49e2-4dda-9fa8-88349065a3a5,https://he.wikipedia.org/wiki/דרך,דרך,Transportation