extracted_text,uid,wiki_link,article_title,topic
"במסגרת המייזם יוקמו 40 מרכזים ברחבי הארץ במימון משותף של משרד הרווחה ו-she codes;. המייזם יחשב כהצלחה אם 4,440 נשים תוכשרנה וכמחציתן תשתלבנה בתעשיית ההיי־טק.


== קישורים חיצוניים ==

 אתר האינטרנט הר",ec694fbd-2f0b-497a-bbf2-33d1a764519f,https://he.wikipedia.org/wiki/She_codes;,She codes;,Technology
"בעזרת גרסה מתוחכמת למדי של אפיציקלים, תלמי, בספרו אלמגסט משנת 148 לספירה, היה מסוגל לחזות נתיבים פלנטריים. למנגנון אנטיקיתרה, משנת 80 לפנה""ס, הייתה מערכת גלגלי שיניים כה מורכבת שהייתה מסוגלת אף לקרב א",87d1dfa4-7cbc-4698-bf77-7c230a03b630,https://he.wikipedia.org/wiki/גלגלי_שיניים_אפיציקליים,גלגלי שיניים אפיציקליים,Technology
"דימות תרמי (ידוע גם כרישום חום, הדמאה תרמית, תרמוגרפיה או תרמוגרפיית תת-אדום) הוא תחום מדעי פיזיקלי והנדסי העוסק בדימות, המתבצע על בסיס קליטת קרינה תת-אדומה (Infra-Red או IR), הנפלטת מכל עצם בעל טמפרט",c566b6a0-289e-4bdc-863e-80e313bd8ed0,https://he.wikipedia.org/wiki/דימות_תרמי,דימות תרמי,Technology
"בקבוק הוא כלי קיבול עם צוואר פייה צר המשמש לאחסון נוזלים ועשוי לרוב זכוכית או פלסטיק, שקוף, חצי אטום או אטום.


== אטימולוגיה ==
מקור המילה בקבוק הוא בספר ירמיהו והיא אונומטופיה: חיקוי הצליל 'בק-בוק' ",b3a1d19c-d030-4391-8cb1-e1f2907b3aa5,https://he.wikipedia.org/wiki/בקבוק,בקבוק,Technology
"בתופעה הזו שומעים רעש חזק הדומה לפעמים לסופת רעמים. גם בתופעה הזו משתמשים לעיתים במונח הלם מים אף על פי שהמנגנון שונה. זו הסיבה שבדרך כלל מקפידים לנקז קווי קיטור וקווי גז חם המכילים נוזל.


== לקריאה ",e3f86c0f-0f24-48f1-89cd-d64604cc3bd6,https://he.wikipedia.org/wiki/הלם_מים,הלם מים,Technology
"יש המנסים להפריד בין תאוריות מדעיות בשלות לבין תאוריות בלתי בשלות, ולטעון שרק תאוריות מדעיות בלתי בשלות התגלו כשקריות, ואילו תאוריות בשלות היו קרובות לאמת. האתגר, הוא להגדיר בשלות של תאוריות באופן נפר",a4f9536d-7f3c-40e3-a46d-7adc0d86faf0,https://he.wikipedia.org/wiki/פילוסופיה_של_המדע,פילוסופיה של המדע,Science
"חוק הטבע עשוי להתגלות כנכון רק בסייגים, כפי שהיה עם חוקי הטבע של גלילאו, כשאלה סוייגו בידי ניוטון. מעבר לזאת, גם אם הוא ממשיך להיחשב כנכון, הוא עשוי להפוך לבר הוכחה. למשל, כיום, חוקי קופרניקוס, הטועני",1e82bb76-2bb4-4b25-8c23-562049347b3f,https://he.wikipedia.org/wiki/חוק_טבע,חוק טבע,Science
"הפילוסופיה האריסטוטלית יחד עם לימוד מדעי המתמטיקה קודמו על-ידי אבו יוסוף אל קנדי (חי בשנת 830), שהיווה אחד היסודות בהקמת הזרם האיסמעילי באסלאם שיעי. שיאה של ההגות והמדע הפורמלי הגיע באל-אנדלוס במאה ה-",713eda79-099d-41da-aa4b-5a8ef2a521fc,https://he.wikipedia.org/wiki/מדע,מדע,Science
"מאז ובמשך השנים הפך תחום האגרוטק הפך לאחד מתחומי העיסוק המרכזיים של החברה בנוסף החלה לעסוק בייזום וקידום מחקרים עבור תעשיית הפלסטיק בישראל, התעשייה הפרמצבטית בישראל ותעשיית האלקטרוניקה בישראל; ייעוץ מ",12f9f79c-e763-4fea-af56-c2870289dbf6,https://he.wikipedia.org/wiki/מדע_שימושי,מדע שימושי,Science
"עבודה זו הגיעה לשיאה בפרסום משנת 1972 של Full Circle: The Moral Force of Unified Science. עם זאת, חלק גדול של עבודתם של האסקל ובני דורו לא פורסם. לאחרונה טימותי ווילקן ואנתוני ג'אדג' הרחיבו את התובנות",87f1d453-dc82-4e16-8302-692afe524bb3,https://he.wikipedia.org/wiki/אחדות_המדע,אחדות המדע,Science
"טימונס סבור כי מגמות השיפור נובעות מכך שאימון HIIT משתמש בכ-80% משרירי הגוף, בעוד ריצה קלה ודיווש על אופניים משתמשים בכ-40%.


=== מחלות קרדיו-ואסקולריות ===
מחקר שערכו בוצ'אן ועמיתיו בשנת 2011 המעריך",7c8b073c-5e90-407d-b7b1-f443885dfd6b,https://he.wikipedia.org/wiki/HIIT,HIIT,Sports
"שיטות נפוצות לטורנירים היום הן:

ליגה – כאשר כל תחרות עצמה כוללת רק שני משתתפים (למשל, שתי קבוצות כדורגל או שני שחקני שחמט) הליגה היא שיטה לארגון התחרויות שבה כל קבוצה או יחיד מתמודדים נגד כל יתר הירי",6706762e-cf56-4cf8-bd17-865cd1bf647b,https://he.wikipedia.org/wiki/טורניר,טורניר,Sports
"אכילס, כמנהיג התחרויות הללו, מציע פרסים כמספר המשתתפים. הפרסים היו חלק מרכושו ומכלי נשקו של החלל, ובנתינתם כפרס, הושג אפקט שימור שם הנפטר ופועלו.
המשחקים האולימפיים העתיקים נערכו כל ארבע שנים ביוון הע",0a10849a-1645-4417-acfc-217fc09aaf32,https://he.wikipedia.org/wiki/היסטוריה_של_הספורט,היסטוריה של הספורט,Sports
"ספורטאים הגבוהים במימד המוחצנות ופתיחות מחשבתית שהראו יותר שליטה רגשית דיווחו על שימוש באסטרטגיות ממוקדות-בעיה לפתרון בעיות. ספורטאים הגבוהים בממדים מצפוניות, מוחצנות, פתיחות ונעימות דיווחו על יותר שי",e964c731-5ae2-41c1-b3e9-020ad6ce2109,https://he.wikipedia.org/wiki/אישיות_בספורט,אישיות בספורט,Sports
מכוח המילוי אחרי הקוד הבינלאומי נגד סמים בספורט מ-2009 מכירות כל החתומות על הקוד בסמכות בית הדין בקשר להפרת הכללים בנושא זה. בפועל חלק ניכר מן התיקים המתבררים בפני בית הדין עוסקים בטענות על שימוש בסמי,905b6a66-11fe-49c2-9655-634862002680,https://he.wikipedia.org/wiki/בית_הדין_לבוררות_בספורט,בית הדין לבוררות בספורט,Sports
"מבחינת כלי הנגינה, מנסים לנגן בצורה שונה לצורך הפקת צלילים ייחודיים יותר ושגרתיים פחות, וכן להשתמש בכלי נגינה ייחודיים ושאינם משמשים באותו סגנון מוזיקה שההגדרה ""אוונגרד"" משויכת אליו.
דוגמה מוכרת לכך ה",d7457b31-0fbc-4835-ab45-bdd4bb658e33,https://he.wikipedia.org/wiki/אוונגרד,אוונגרד,Arts
"אִלתור, או מלועזית: אימפּרוֹביזציה (Improvisation, או בקיצור Improv - אימפרוב), הוא הפעולה של יצירת דבר חדש ושונה במשך תקופת זמן מסוימת ללא תכנון מקדים.

מקור השם ""אלתור"" בעברית מהביטוי ""על אתר"" בארמי",9e4f4b6f-cd1e-4e17-8819-bdd5dcd6d299,https://he.wikipedia.org/wiki/אלתור,אלתור,Arts
"חקיקה זו משקפת את האיסור הקבוע בסעיף 3(ב) לאמנה, בדבר שימוש, הצעה או רכישה של ילד לזנות ולפורנוגרפיה. במסגרת מנגנוני הפיקוח של ה-ILO, נדרשה ישראל למסור נתונים בדבר אכיפה ויישום האמנה. בהקשר זה, חוקק ח",4669c583-b81c-4fc1-8ecd-afda57242e4b,https://he.wikipedia.org/wiki/אמנה_182_לביעור_צורות_העסקה_חמורות_של_ילדים,אמנה 182 לביעור צורות העסקה חמורות של ילדים,Arts
"היו מוסכמות ביחס לאופן בו כל דמות מוצגת, אך לא היו כללים נוקשים, כך שתכונות איקונוגרפיות היו נתונות לשינוי.

אוונגליסטים (מחברי הבשורות) מחזיקים לעיתים קרובות ספרי בשורה
קדושים אנשי דת לובשים בגדי כמו",68845084-8ea2-4de4-8fee-ef08f5bf20c2,https://he.wikipedia.org/wiki/אטריבוט_(אמנות),אטריבוט (אמנות),Arts
"קפלי מוצא אלו נקראים בסיסים.
מספר דוגמאות לקיפולים מורכבים ולבסיסים בהם נעשה שימוש נפוץ:

קיפול הפוך פנימי וקיפול הפוך חיצוני – קפלים המורכבים משילוב בו-זמני של שני קפלי הר או שני קפלי עמק, הנעשים על ",931f0987-6156-4a7e-b62e-a2b1e902d2dc,https://he.wikipedia.org/wiki/אוריגמי,אוריגמי,Arts
"גם מוזיקאים שכיום ידוע שחוו חיים מלאי צרות ומשברים, לא הביעו נושאים אלה במוזיקה שלהם. דוגמה טובה לכך הוא סיפורו של המלחין יוזף היידן, שהועסק במשרות שונות בחצרות של נסיכים, ומצבו הרע כמוזיקאי מתבטא ב""ס",a918e5e0-dd4d-40db-aed3-8aef1e2493a7,https://he.wikipedia.org/wiki/מעמד_המוזיקאי_בחברה_המערבית,מעמד המוזיקאי בחברה המערבית,Music
"מונח זה מתייחס לתפקידים של המוזיקאי המוביל בקרב חברי הלהקה, כחבר עם התרומה המשמעותית ביותר לתדמית הלהקה בתקשורת לרבות דובר הלהקה בראיונות ובפני הציבור.
המונח נפוץ מאוד במוזיקת הרוק והפופ.
ישנם מקרים ב",5e4def34-623b-4784-86b6-b3c73dc2ed2b,https://he.wikipedia.org/wiki/סולן,סולן,Music
הוריה של וואיט השתייכו לכנסייה האפיסקופלית באמריקה. אימה של וואיט אהבה במיוחד שירת המנונים ועודדה את וואיט להקפיד על זמני תפילה בשעות הבוקר והערב יחד עם שירת המנונים. היא נישאה בגיל צעיר לספנסר (באנגל,d5649c40-366e-48c1-b744-b0fc63cee0f2,https://he.wikipedia.org/wiki/מוזיקה_בדת_הבהאית,מוזיקה בדת הבהאית,Music
"לִבְרִית, ובלעז לִיבְּרֶטּוֹ (libretto), היא השם הכולל לטקסט של יצירה מוזיקלית ווקאלית-בימתית, כגון: אופרה, אופרטה, אורטוריה או מחזמר.
מקור המילה באיטלקית ופירושה ""סִפרון"". בלברית נכלל התמליל בקטעים ה",2b885901-1500-4af1-82f3-e51ad0f104bf,https://he.wikipedia.org/wiki/לברית,לברית,Music
"במקרים רבים די בעובדה שהשיר מושר בפי זמר או להקה ידועים כדי שהוא יהפוך להיט.


== אטימולוגיה ==
המילה ""להיט"" מבוססת על שילוב המילה האנגלית ""Hit"" עם המילה העברית ""להט"" (תרגום שומר משמעות וצליל). היא הו",ec41933f-cd0e-4a86-916f-fcc26142c638,https://he.wikipedia.org/wiki/להיט,להיט,Music
"המגמה פעלה ספציפית רק באמצעות כלים אמנותיים, ולא רצתה להיות כלי של פוליטיקה.
במילותיו של Lajos Kassák במאמר המגדיר שלו עבור כתב העת ""היום"" :


== הנציגים הראשיים של המגמה ==
שאנדור בורטניק
לאיוש קשאק
",a4c9de8f-1d10-44d4-a650-49af637e7292,https://he.wikipedia.org/wiki/אקטיביזם_(אמנות),אקטיביזם (אמנות),Literature
"המיתוס המכונן של האומה הקדומה הקוריאנית בדרך כלל מגדיר את קו הדם האבהי של המייסד כצ'ונסין (בקוריאנית: 천신; הנג'ה: 天神, אל השמים) ואת קו האם כג'יסין (בקוריאנית: 지신; הנג'ה: 地 神, אלת הארץ). כתוצאה מכך, אונ",03c546bf-ff1d-407e-a98d-196e4968259c,https://he.wikipedia.org/wiki/אונגנייאו,אונגנייאו,Literature
"ספרות אפורה היא ספרות מקצועית הנוצרת, מופצת ומתפרסמת באופן עצמאי על ידי גופים שונים כגון מוסדות ציבור, מוסדות של המגזר השלישי, אגודות מקצועיות, אקדמיה ועוד, וזאת ללא מעורבות של מו""לים מסחריים (כלומר ג",af1a6b7b-4529-4d51-a53c-1090553cdf12,https://he.wikipedia.org/wiki/ספרות_אפורה,ספרות אפורה,Literature
"הקבוצה עסקה בנושאים דתיים. על אף שגם בארצות הברית המשיכה אן האצ'נסון במפגשי הנשים, ואף גברים השתתפו בכינוסים אלו, ליוזמה זו לא היה המשך.
התכנסות הנשים במטרה לדיון בספרים החלה כבר במחצית הראשונה של המא",02427a31-a0e8-4b0b-841f-8c8550610f99,https://he.wikipedia.org/wiki/מועדון_קריאה,מועדון קריאה,Literature
"לדיקציה יש השפעה גם על בחירת מילים ותחביר.
דיקציה לרוב נקבעת על ידי סטנדרטים רווחים של כתיבה ודיבור נכונים ונחשבים כאינדיקציה לאיכות הכתיבה. היא עלולה גם לבוא לידי ביטוי בבחירת מילים או ביטויים העשויי",1dbbbd96-4c66-4e4d-ae96-33adce678e9b,https://he.wikipedia.org/wiki/דיקציה,דיקציה,Literature
"ניתוח של השימוש בטכנולוגיות גיאו-מרחביות בחופשת אתרים כזו הוצע על ידי תירי ג'וליבו (Thierry Joliveau) ב-The Cartographic Journal. תאגידים, מועצות, ועידות ותיירות עקבו אחר המגמה באותה שנה ויצרו מפות נס",468f9b43-ff76-4f42-88ae-8074e1351cdc,https://he.wikipedia.org/wiki/Setjetting,Setjetting,Cinema
"כיסא במאים (באנגלית: Director's chair) הוא כיסא קל, מתקפל, שניתן לקפלו בתנועת מספריים. משענת הגב של הכיסא והמושב עשויים בד או פלסטיק גמיש ומתקפל. רגלי הכיסא וידיותיו עשויים לרוב עץ ולעיתים נדירות יותר",9680c0a4-eec5-4d0e-813d-110c35d27d2a,https://he.wikipedia.org/wiki/כיסא_במאים,כיסא במאים,Cinema
"FIAPF (באנגלית: International Federation of Film Producers Associations) הוא ארגון המורכב מ-36 אגודות חברות מ-30 המדינות המובילות בעולם בתחום האודיו-ויז'ואל. FIAPF, שמטהו בלונדון גם אחראי על הרגולציה ",58571e2f-33f7-4cec-9393-dffa24138766,https://he.wikipedia.org/wiki/FIAPF,FIAPF,Cinema
"ב-1897 שלחו האחים לומייר צלם בשם אלכסנדר פרומיו אל המזרח, ובין היתר צילם פרומיו את הסרטים הראשונים המראים את ארץ ישראל. באותה שנה, 1897, שהה צוות הסרטה אחר בארץ, מטעם הכנסייה הקתולית בצרפת – האב ביילי",9a03ad96-7c3a-4264-acf5-b7dd63f13654,https://he.wikipedia.org/wiki/ראינוע,ראינוע,Cinema
"לפיכך, במחצית הראשונה של המאה ה-20, היווה הקולנוע את אמצעי תקשורת ההמונים היחיד לשידור תוכן מוסרט, ולכן נהגו לשדר באולמות הקולנוע, מלבד סרטים, גם תכנים אחרים, בהם סדרות.


== מאפיינים ==
במונחים בני י",aebfb385-4ada-4619-a49c-a880356970be,https://he.wikipedia.org/wiki/סדרת_קולנוע,סדרת קולנוע,Cinema
"תחום הקשור קשר הדוק למיקרו-היסטוריה הוא ז'אנר הביוגרפיה ההיסטורית, המספר את חייו של אדם בהקשרו ההיסטורי ואת המורשת שהותיר.
היסטוריה ציבורית כוללת פעילויות המציגות את ההיסטוריה לציבור הרחב. הדבר קורה ב",6f8f54f5-fd19-4687-ae24-c810ded5c9c3,https://he.wikipedia.org/wiki/היסטוריה,היסטוריה,History
"אלו הן חלק מן ההשפעות של האידאולוגיות הללו על ההיסטוריה:

הסוציאליזם:
בגרסתו המהפכנית הביא הסוציאליזם למהפכת אוקטובר בשנת 1917 ברוסיה, שהביאה להקמתה של ברית המועצות, שהייתה אחת משתי המעצמות הגדולות וה",35959a40-458c-41e2-9b07-480f059eb9a7,https://he.wikipedia.org/wiki/אידאולוגיה,אידאולוגיה,History
"מפתחי השיטה טוענים כי ניתן גם למצוא מוצא גנאלוגי משותף לקבוצות אנשים ודמיון משפחתי, מהלך מאות בשנים לאחור.
במאמר שפורסם בשנת 2018 על ידי ד""ר אדם רתרפורד (Adam Rutherford) נטען כי אפשר להתחקות אחר שושל",7b5887fe-3983-497a-aa87-1d70c40fe6af,https://he.wikipedia.org/wiki/גנאלוגיה,גנאלוגיה,History
מדעי עזר בהיסטוריה  הם מדעים אשר עוזרים להעריך ולהשתמש במקורות היסטוריים וככאלו מהווים מדעי עזר למחקר ההיסטורי. רבים מן התחומים הללו התפתחו בין המאה ה-16 לה-19 על ידי האנטיקווארים וככאלו הוגדרו תחת תח,65391332-16c2-44a1-b4bf-5ab670cb88c0,https://he.wikipedia.org/wiki/מדעי_עזר_בהיסטוריה,מדעי עזר בהיסטוריה,History
"מבחינו, השפעות הגאוגרפיה, האקלים, הדמוגרפיה והטכנולוגיה הולכות מעבר להשפעת אירוע קונקרטי זה או אחר. כלומר, ההמשכיות של מבני עומק היא חלק מרכזי מההיסטוריה. תפיסה זו קיבלה ביטוי בחיבורו המרכזי, ""הים התי",73ff4fae-7081-4c50-b9eb-de43b58b11d6,https://he.wikipedia.org/wiki/אסכולת_האנאל,אסכולת האנאל,History
"משטחים שטופלו בחומר משטח כמו סבון, הופכים הידרופיליים ויראו זווית. קרובה ל-0, ולא תיווצר טיפה.


== חשיבות ההידרופיליות ברפואה ==
בטיפולים חודרניים, והשתלות של חומרים שאינם ביולוגיים, חשוב שפני השטח ש",1a4ca35e-69cc-4479-be65-4e067673cc00,https://he.wikipedia.org/wiki/הידרופיליות,הידרופיליות,Biology
"ההיררכיה משתרעת מאטומים עד לביוספרות.
כל רמה בהיררכיה מורכבת מקודמתה ומהווה בסיס לזאת שאחריה, וכל עלייה ברמה מייצגת עלייה במורכבות המבנה הביולוגי, כלומר שכל ""אובייקט"" מורכב בעיקרו מהיחידות של הרמה הקו",4bb709ef-50be-440f-8655-c7141ea87ea5,https://he.wikipedia.org/wiki/ארגון_ביולוגי,ארגון ביולוגי,Biology
"זהו מנגנון המוטציה, המתרחש בחומר התורשתי של האורגניזמים ואחראי ליצירת תכונות חדשות. הברירה הטבעית ותהליך המוטציה יוצרים יחדיו את התפישה המקובלת כיום לאבולוציה – נאו-דרוויניזם.


=== מגוון ===
 ערך מור",46943008-f8f4-464e-bd82-36d4ca07e295,https://he.wikipedia.org/wiki/ביולוגיה,ביולוגיה,Biology
"חומרים ותהליכים אנדוגניים הם אלה שמקורם במערכת חיה כגון אורגניזם, רקמה או תא.
לעומת זאת חומרים ותהליכים אקסוגניים הם אלה שמקורם מחוץ לאורגניזם.
לדוגמה, אסטרדיול הוא הורמון אסטרוגן אנדוגני, המיוצר בגוף",603955e2-9959-4c40-b3ca-17d359c42046,https://he.wikipedia.org/wiki/אנדוגני_(ביולוגיה),אנדוגני (ביולוגיה),Biology
"בדוגמה לעיל, נאמר שיש אינטראקציה בין שני האלקטרונים (שביניהם עבר הפוטון).


== בסוציולוגיה ==
בסוציולוגיה, אינטראקציה חברתית היא רצף דינמי ומשתנה של פעולות חברתיות בין יחידים (או קבוצות) אשר משנים את ",8a9e3bbb-8f34-4659-9017-b89f89a8ec24,https://he.wikipedia.org/wiki/אינטראקציה,אינטראקציה,Biology
"PubChem הוא בסיס נתונים כימי ענק המכיל גם מידע אודות ההשפעות הביולוגיות של החומרים על אורגניזמים.
המאגר מנוהל על ידי המרכז הלאומי למידע ביוטכנולוגי (NCBI) של ארצות הברית, שהוא חלק מהמכונים הלאומיים לב",d8e3de8f-4a1f-4f10-88e5-f0d6ffa457b1,https://he.wikipedia.org/wiki/PubChem,PubChem,Chemistry
"שהחלה לפרסם את האנציקלופדיה גם באינטרנט.
ערך על תרכובת באינדקס מרק יכלול לרוב:

מספר ה-CAS של התרכובת.
השמות הנפוצים של התרכובת ושם הIUPAC שלה.
הנוסחה הכימית של התרכובת.
המסה המולקולרית של התרכובת.
שר",7fda2e77-102c-4c15-b1a7-5a182db544fe,https://he.wikipedia.org/wiki/אינדקס_מרק,אינדקס מרק,Chemistry
"אולם, אנרגיית חום מועברת בקלות כמעט מכל חומר, והסיבה העיקרית לכך היא כיוון שרמות האנרגיה התנודתיות והסיבוביות ממוקמות אחת ליד השנייה באטום. כיוון שרמות האנרגיה של האלקטרונים לא קרובות זו לזו, קרינה אל",934b8181-a159-4d32-87c5-05ac6bc059bb,https://he.wikipedia.org/wiki/כימיה,כימיה,Chemistry
"רוחב כל בלוק נקבע על פי מספר האלקטרונים המקסימלי שיכולים לאכלס את האורביטלים באותו הבלוק: בלוק s הוא ברוחב 2 יסודות, בלוק p ברוחב 6, בלוק d ברוחב 10 ובלוק f ברוחב 14. קיימות גם תיאוריות לגבי בלוקים נו",e484962a-de5c-40f2-92a1-b67e51ff1d31,https://he.wikipedia.org/wiki/בלוק_(כימיה),בלוק (כימיה),Chemistry
"לעיתים ניתן לייצר, לפחות תאורטית, מחומר מהאנלוג המבני שלו. אנלוגים מבניים הם לרוב איזואלקטרוניים .
אף על פי שבדרך כלל קיים דמיון כימי גבוה בין אנלוגים מבניים, הם אינם בהכרח אנלוגים פונקציונליים  ועשוי",37b901eb-15bd-44a9-b5c2-f64dc2976a27,https://he.wikipedia.org/wiki/אנלוג_מבני,אנלוג מבני,Chemistry
"זה יוצר כוח אלקטרומניע וזרם חשמלי, ובכך חלק מהאנרגיה של האור מומרת לאנרגיה חשמלית. האפקט הפוטו-וולטאי יכול להתרחש גם כאשר שני פוטונים נבלעים בו זמנית בתהליך שנקרא אפקט פוטו-וולטאי של שני פוטונים.


==",68988af2-03c9-4ce5-81fb-d0109c4ddaf0,https://he.wikipedia.org/wiki/האפקט_הפוטו-וולטאי,האפקט הפוטו-וולטאי,Physics
"כך לדוגמה האטומים בצברים של גזים אצילים (הליום, ניאון, ארגון...) נוטים להסתדר במבנה איקוסהדרלי, ומתקבלים צברים יציבים במיוחד כאשר מספר האטומים מתאים בדיוק למספר הדרוש על מנת לסגור קליפה איקוסהדרלית. מ",fdd33698-57cc-4a42-8bdf-9258e4dcce1b,https://he.wikipedia.org/wiki/מספר_קסם_(מדע),מספר קסם (מדע),Physics
"ביסוד תורת המיתרים עומדת ההנחה שהיקום הוא בעל ממד גבוה אף יותר, כאשר הממדים הגבוהים ""מכורבלים"" ולא ניתן למדוד אותם ישירות. ראו גם ממד בפיזיקה.


== מתמטיקה ==
 ערך מורחב – מרחב (מתמטיקה)
הנדסת המרחב ע",49032937-ff02-4233-b3ba-ad5a6d5bbd7b,https://he.wikipedia.org/wiki/מרחב_תלת-ממדי,מרחב תלת-ממדי,Physics
"בפילוסופיה ובפיזיקה הקדומה עלתה השערה, שמיוחסת לאריסטו, לפיה הטבע מתנגד לקיום ריק, מרווחים בתוך התווך הרציף בין הדברים. בלטינית השערה זו קיבלה את השם ""אימת הריק"" (בלטינית: horror vacui), ונוסחה לעיתים",020d33b8-fbc2-4223-83b7-38bff1bac9ff,https://he.wikipedia.org/wiki/אימת_הריק_(פיזיקה),אימת הריק (פיזיקה),Physics
